source_doc_id,date,sentence,found_term
1043,2014-06-06 21:00:00,"But there is one fact that all of us, including our European friends and partners, must take into account: the risk of non-payment remains very high, and if somebody thinks that they can resolve the problems of Ukrainian energy supply through reverse supplies, they are deeply mistaken.",ukrainian
1043,2014-06-06 21:00:00,"Moreover, the high risk of non-payment remains, given that Ukraine’s economy is in a tight situation and these risks of non-payment will then fully fall onto the shoulders of our European partners.",ukraine
1049,2014-06-11 16:00:00,"The first remark concerns the energy talks we have been holding with our Ukrainian partners, talks that have not been easy.",ukrainian
1049,2014-06-11 16:00:00,"Energy Minister Alexander Novak and Gazprom CEO are meeting with our Ukrainian partners, with European Commissioner Mr Oettinger acting as intermediary.",ukrainian
1049,2014-06-11 16:00:00,"Gazprom has proposed our Ukrainian partners exactly the same conditions as it offered Viktor Yanukovych’s government: a discount on the contract price of $100, which makes a final price of $385 per 1,000 cubic metres of gas.",ukrainian
1049,2014-06-11 16:00:00,"As we understand the situation, our Ukrainian partners are worried that this discount could be unilaterally cancelled as easily as it was offered.",ukrainian
1049,2014-06-11 16:00:00,But I nevertheless ask the Government and the Prime Minister to look at what could be done at the government level or through our agreements with the Ukrainian government to cement these conditions and make them absolutely reliable and unchanging for an agreed period.,ukrainian
1049,2014-06-11 16:00:00,"The issue is that our Ukrainian partners find these discounts insufficient and want more, though it is not very clear on what grounds.",ukrainian
1049,2014-06-11 16:00:00,I think that our offer is made in a more than genuine spirit of partnership aimed to help and support the Ukrainian economy as it traverses this difficult time.,ukrainian
1049,2014-06-11 16:00:00,"In order to support Ukraine’s economy and, to be honest, in order not to lose a customer, which is also important, we will act as we propose to our customers, that is to say, we will be open, honest, and as transparent as possible in our actions.",ukraine
1054,2014-06-17 14:40:00,Now Ukrainian prices are higher everywhere?,ukrainian
1057,2014-06-22 12:30:00,I think that what is happening in Ukraine is an immense tragedy.,ukraine
1057,2014-06-22 12:30:00,"It is important that this ceasefire open the way to a dialogue between all of the parties to the combat, so as to find solutions that will be acceptable to all sides, in order to ensure that people in southeast Ukraine have no doubt that they are an integral part of the country, have the same rights as all other citizens, and know that these rights are guaranteed, including by Ukraine’s constitution.",ukraine
1057,2014-06-22 12:30:00,"Unfortunately, objective monitoring shows that military operations have not ended, and just last night there was quite active artillery fire on the Ukrainian side.",ukrainian
1060,2014-06-24 17:40:00,"As for the more acute issues, including the problems around Ukraine, I am sure our position coincides on some, while others require clarification and agreement, but that can only be achieved through dialogue.",ukraine
1061,2014-06-24 20:00:00,"Mr President and I have also discussed in detail burning international issues, including – and my colleague has just spoken of this – the dramatic developments in Ukraine.",ukraine
1061,2014-06-24 20:00:00,"At the same time, we certainly support the intention of the Ukrainian authorities and of President Poroshenko not only to declare a truce, but also to achieve results.",ukrainian
1061,2014-06-24 20:00:00,"This will undoubtedly serve the cause of resolving complicated conflicts, including the one in Ukraine.",ukraine
1061,2014-06-24 20:00:00,"Mr President Putin, the European Union is trying to use sanctions to correct its policy in Ukraine, to encourage Ukraine to follow a different policy.",ukraine
1061,2014-06-24 20:00:00,Do you view Austria as an ally in the fight for Ukraine?,ukraine
1061,2014-06-24 20:00:00,"I told Mr President and can tell you about it, we also said this to the Ukrainian side, including President Poroshenko: declaring a ceasefire is not enough.",ukrainian
1061,2014-06-24 20:00:00,"If we hear or continue to hear that we have seven days and we must disarm within those seven days of ceasefire, but not a single attempt is made during that period to reach a substantive agreement with east Ukraine, then all the efforts will be for nothing and there will be no results.",ukraine
1061,2014-06-24 20:00:00,"But if we see that substantive talks have begun, so that people in east Ukraine can finally understand how their legal interests will be guaranteed, then there is a high chance of success.",ukraine
1061,2014-06-24 20:00:00,"I am very pleased and happy to note that yesterday, the first direct contact between authorities in Kiev and representatives from southeast Ukraine in Donetsk and Lugansk occurred.",ukraine
1061,2014-06-24 20:00:00,The part of your question regarding my letter to the upper chamber of the Russian parliament asking to cancel the resolution empowering the President of Russia to use the Armed Forces on Ukraine’s territory.,ukraine
1061,2014-06-24 20:00:00,"Yes, I will not deny, as I have already said, that we used our military units to guarantee the free expression of will by the people of Crimea; we blocked the activities of some Ukrainian army units so that they did not get involved in the process of expression of will, and to ensure there were no victims.",ukrainian
1061,2014-06-24 20:00:00,"The best approach is not to demand disarmament, especially from the eastern part of Ukraine, especially while radical forces such as the “Right Sector” and the like are still not disarmed, although they have talked about it many times and promised that these unlawful formations will lay down their arms.",ukraine
1061,2014-06-24 20:00:00,That is why I called on the upper chamber of the Russian parliament to revoke the resolution on the right to use the Armed Forces in Ukraine.,ukraine
1061,2014-06-24 20:00:00,But I count on the peace process to develop in the direction of resolving issues concerning the lawful rights of citizens living in the eastern part of Ukraine.,ukraine
1061,2014-06-24 20:00:00,"Of course, we will always protect ethnic Russians in Ukraine and the part of the Ukrainian population, the Ukrainian people, who feel not just an ethnic but also a cultural connection to Russia, who feel themselves part of the greater Russian community.",ukraine
1061,2014-06-24 20:00:00,"First of all, we are not laying down any preliminary conditions during the talks between the authorities from Kiev and east Ukraine, mainly because Russia is not a party to this conflict.",ukraine
1061,2014-06-24 20:00:00,"We believe, and it is impossible to avoid it, that talks need to be launched on the future structure of Ukraine itself and ensuring the rights, the lawful rights and interests of the people living in southeast Ukraine.",ukraine
1061,2014-06-24 20:00:00,"People in central and western Ukraine took up arms, while people in the east said, “Well, if they can take up arms, why can’t we?”",ukraine
1061,2014-06-24 20:00:00,"Incidentally, answering your Austrian colleague’s question, I can say that this is not about a desire to bypass Ukraine.",ukraine
1061,2014-06-24 20:00:00,And what about Nord Stream – was that an attempt to bypass Ukraine?,ukraine
1061,2014-06-24 20:00:00,Is that an attempt to bypass Ukraine?,ukraine
1062,2014-06-24 22:00:00,"This is particularly important against the background of the serious crisis in Ukraine, which is a transit route for the biggest gas pipeline system.",ukraine
1062,2014-06-24 22:00:00,We hope that our Ukrainian friends will succeed in resolving all of these problems through a process of internal political dialogue.,ukrainian
1063,2014-06-24 23:45:00,I know that you and the OSCE   Background information Organization for Security and Co-operation in Europe (OSCE)    are making great efforts at present to bring about a change for the better in the situation in Ukraine.,ukraine
1063,2014-06-24 23:45:00,Our joint efforts have succeeded in getting the first contacts between Ukraine’s east and the authorities in Kiev underway.,ukraine
1064,2014-06-25 17:45:00,"Among the various issues discussed, we also spoke about sensitive matters, issues such as the events in eastern Ukraine.",ukraine
1067,2014-06-27 13:45:00,"Russia is consistent in supporting greater openness in global affairs and resolving problems through political and diplomatic means, be it the situation in Syria, the Iranian nuclear programme, the situation on the Korean Peninsula, Afghanistan, the Middle East, or the current tragic developments in Ukraine.",ukraine
1067,2014-06-27 13:45:00,We are particularly concerned about the situation in Ukraine.,ukraine
1067,2014-06-27 13:45:00,The anti-constitutional coup in Kiev and attempts to force the Ukrainian people into an artificial choice between Europe and Russia have pushed society into division and painful internal confrontation.,ukrainian
1067,2014-06-27 13:45:00,"Ukraine must return to the road of peace, dialogue and harmony, but most importantly, it has to ensure a lasting ceasefire as an essential condition for holding substantial negotiations between the Kiev government and representatives of the southeast regions.",ukraine
1070,2014-07-01 15:45:00,We are observing this in Ukraine as well.,ukraine
1070,2014-07-01 15:45:00,We need to understand clearly that the events provoked in Ukraine are the concentrated outcome of the notorious deterrence policy.,ukraine
1070,2014-07-01 15:45:00,"In Ukraine, as you may have seen, at threat were our compatriots, Russian people and people of other nationalities, their language, history, culture and legal rights, guaranteed, by the way, by European conventions.",ukraine
1070,2014-07-01 15:45:00,What did our partners expect from us as the developments in Ukraine unfolded?,ukraine
1070,2014-07-01 15:45:00,I would like to stress that what happened in Ukraine was the climax of the negative tendencies in international affairs that had been building up for years.,ukraine
1070,2014-07-01 15:45:00,"You know about the latest efforts to restore, to maintain peace in Ukraine.",ukraine
1070,2014-07-01 15:45:00,"We also failed to agree to make public the statement approved by the foreign ministers of Germany, France, Russia and Ukraine on the need to maintain peace and search for mutually acceptable solutions.",ukraine
1070,2014-07-01 15:45:00,"Even within Ukrainian society there is a discussion of whether it is good or bad, but nobody definitely ever discussed it with the east.",ukrainian
1070,2014-07-01 15:45:00,"Of course, everything that is going on in Ukraine is the internal affair of the Ukrainian state.",ukraine
1070,2014-07-01 15:45:00,I reminded the Ukrainian President of this yesterday yet again.,ukrainian
1070,2014-07-01 15:45:00,We strongly hope that the Ukrainian authorities act on their promises to carefully investigate the crimes.,ukrainian
1070,2014-07-01 15:45:00,The events in Ukraine prove this.,ukraine
1070,2014-07-01 15:45:00,"If we return to Ukraine, the violation by Ukraine of its commitments regarding the purchase of our natural gas has become a common problem.",ukraine
1070,2014-07-01 15:45:00,"Now, as you may know, the court in Kiev has lifted all accusations against Ukraine’s former Prime Minister Tymoshenko, who signed the contract.",ukraine
1070,2014-07-01 15:45:00,"Thus, the Kiev court authorities admit that they have done everything right not only by international law, but by Ukrainian law as well.",ukrainian
1070,2014-07-01 15:45:00,"As of June 16, as you may know, we have transferred Ukraine to a pre-payment system, so they will get exactly the amount of gas they pay for.",ukraine
1070,2014-07-01 15:45:00,The main thing is that honest gas consumers and suppliers should not suffer from the actions of Ukrainian politicians and bureaucrats.,ukrainian
1070,2014-07-01 15:45:00,"Generally, all of us – Ukraine, our European partners, and we – should seriously consider how to reduce the probability of any type of political or economic risks or force majeure situations on the continent.",ukraine
1070,2014-07-01 15:45:00,"All of us in Europe need a sort of safety net to make sure that Iraqi, Libyan or Syrian – and unfortunately, I have to say also Ukrainian – precedents do not become contagious.",ukrainian
1070,2014-07-01 15:45:00,"The Foreign Ministry’s staff in Moscow and the Russian embassies abroad worked effectively and in coordinated fashion during the serious situation with Crimea and Ukraine, and I want to thank you for this.",ukraine
1084,2014-07-10 17:00:00,"Only not in Ukraine – there is hardly anything we can do there, but for those who have come from Ukraine.",ukraine
1094,2014-07-15 01:00:00,Serious attention should be given to the crisis in Ukraine and the international community’s measures to stop the bloodshed in the southeast of the country.,ukraine
1102,2014-07-17 03:30:00,"They touched Ukraine, and there are problems there as well.",ukraine
1102,2014-07-17 03:30:00,"There are grave consequences when they are regarded with disdain: disintegration and internal conflicts, as we are currently observing in Ukraine.",ukraine
1102,2014-07-17 03:30:00,Here is what should be done jointly: calling on all sides in the conflict in Ukraine to immediately cease hostilities and start talks.,ukraine
1102,2014-07-17 03:30:00,"But unfortunately, we are not seeing this on the part of our partners, first and foremost our American partners who, on the contrary, it seems to me, are pushing Ukraine’s current authorities toward continuing a fratricidal war and continuing retributive operations.",ukraine
1102,2014-07-17 03:30:00,I would like to begin by saying that Russia is strongly interested in the quickest possible termination of the conflict in Ukraine for a number of reasons.,ukraine
1102,2014-07-17 03:30:00,"I do not know if there is any other country, apart from Russia and Ukraine itself, that would be so interested in stopping the bloodshed and resolving the situation in a neighbouring state.",ukraine
1102,2014-07-17 03:30:00,"In view of the above, we are interested in economic aid to Ukraine, including aid provided by the IMF.",ukraine
1102,2014-07-17 03:30:00,"I believe that is the right approach, and I think it should also be applied to Ukraine.",ukraine
1102,2014-07-17 03:30:00,"This, I believe, is exactly what is happening in Ukraine with the first tranche.",ukraine
1102,2014-07-17 03:30:00,From what I know most of this funding was transferred to banks privately owned by Ukrainian oligarchs.,ukrainian
1102,2014-07-17 03:30:00,"Where is this money now, what happened to it, whose pockets did it end up in – this is something the IMF and the general public in Ukraine and in the countries supporting it should find out.",ukraine
1102,2014-07-17 03:30:00,"Apart from everything else, part of the first tranche of the funding was meant to be used to pay for Ukraine’s commitments under foreign trade contracts.",ukraine
1102,2014-07-17 03:30:00,"What is happening to IMF funding is the same thing that happened to the Russian loans, to the billions of dollars Ukraine received from Russia late last year: there is no debt repayment, no current payments.",ukraine
1102,2014-07-17 03:30:00,"If everything I spoke of is implemented, then of course we are in favour of supporting Ukraine, however not the Ukrainian oligarchs and thieves, but the Ukrainian people.",ukraine
1103,2014-07-18 00:40:00,"Colleagues, You know that a terrible tragedy occurred over Ukraine today: a passenger plane went down.",ukraine
1103,2014-07-18 00:40:00,"In this regard, I would like to note that this tragedy would not have occurred if there were peace in that country, or in any case, if hostilities had not resumed in southeast Ukraine.",ukraine
1103,2014-07-18 00:40:00,"We will do everything – everything that we can, at least – to ensure that an objective understanding of what happened becomes available to the Russian public, to the public in Ukraine and throughout the world.",ukraine
1106,2014-07-18 16:30:00,"We are also watching what is happening in Ukraine, in eastern Ukraine, with alarm and sorrow.",ukraine
1106,2014-07-18 16:30:00,"We also believe peace must triumph as quickly as possible in Ukraine; direct contacts between all conflicting sides should be established as rapidly as possible, and all sides in the conflict should immediately cease hostilities and move on to peace talks.",ukraine
1106,2014-07-18 16:30:00,You know that we are in contact with President of Ukraine Petro Poroshenko.,ukraine
1106,2014-07-18 16:30:00,"I hope that he will be able to stir Ukraine in such a direction as to offer all the people – all people, regardless of where they live – a way of ensuring their lawful rights and interests that would lead to a final, full and long-term peace on this earth.",ukraine
1107,2014-07-21 01:40:00,"In response to the terrible tragedy that took place over Donetsk, I want to reiterate Russia’s position with regard to the current situation in Ukraine.",ukraine
1107,2014-07-21 01:40:00,"I believe that if military operations had not resumed in eastern Ukraine on June 28, this tragedy probably could have been avoided.",ukraine
1107,2014-07-21 01:40:00,"Representatives from the Donbass region, Donetsk, Ukraine’s Emergency Situations Ministry, and Malaysian experts are already working at the site, but this is not enough.",ukraine
1107,2014-07-21 01:40:00,"For its part, Russia will do everything within its power to move the conflict in eastern Ukraine from the military phase we see today to the negotiating phase, with the parties using peaceful and diplomatic means alone.",ukraine
1110,2014-07-22 15:40:00,"Frequently the forces used here are radical, nationalist, often even neo-fascist, fundamental forces, as was the case, unfortunately, in many post-Soviet states, and as is the case with Ukraine now.",ukraine
1110,2014-07-22 15:40:00,"Yesterday when the militia forces were handing over the so-called black boxes, the armed forces of Ukraine launched a tank attack at the city of Donetsk.",ukraine
1114,2014-07-29 16:20:00,"It’s clear that the situation there is complex and the level of tension and antagonism is very high, but naturally, this is a very important humanitarian issue, and I would like to ask you to use your knowhow as a human rights activist to get an answer from your Ukrainian colleagues in an entirely non-confrontational, friendly manner, and to think through, together, how to arrange things to help those children.",ukrainian
1114,2014-07-29 16:20:00,"After all, we are helping the wounded soldiers of the Ukrainian army, we are accepting them in our territory and treating them, sending them back – and overall, doing this with consent from the Ukrainian authorities.",ukrainian
1114,2014-07-29 16:20:00,"But you may have different opinions, different approaches, much softer and more humane, so to speak, and I very much count on you to succeed in reaching an agreement with your colleagues: Ukrainian human rights activists and the official authorities.",ukrainian
1131,2014-08-14 16:15:00,"It is important to fully rehabilitate the repressed peoples and, what I feel is extremely important, to ensure real equality for three languages: Russian, Ukrainian, and Crimean Tatar.",ukrainian
1131,2014-08-14 16:15:00,"Colleagues, unfortunately, today we see how fraught the national and civil divide, radicalism and intolerance is in Ukraine.",ukraine
1131,2014-08-14 16:15:00,"We are carefully monitoring what is happening there, putting these questions before Ukraine’s leadership and the international community, as well as key international organisations, and we will do everything we can in order for this conflict to end as quickly as possible, so that the bloodshed in Ukraine comes to an end.",ukraine
1131,2014-08-14 16:15:00,"After western states – the USA, Europe, Australia, Canada, Norway – introduced limitations, including financial limitations on the activity of Rosselkhozbank – now, what does this bank have to do, say, with our disagreements over Ukraine?",ukraine
1133,2014-08-15 17:00:00,"The disaster that is taking place in Ukraine affects all of us and concerns all of us, and its impact goes far beyond just local consequences.",ukraine
1133,2014-08-15 17:00:00,"It is therefore good to have this chance to discuss the possibilities we have for finding a way of settling the situation in Ukraine, stopping this negative spiral of events and helping to stabilise the situation, because this really is something that affects us all.",ukraine
1134,2014-08-15 17:15:00,Of course we discussed in detail developments in the serious internal political crisis in Ukraine.,ukraine
1134,2014-08-15 17:15:00,We are both seriously concerned about the large-scale military operations in Ukraine’s southeast regions and the genuine humanitarian disaster that is unfolding there.,ukraine
1134,2014-08-15 17:15:00,"These sanctions were imposed because of the Ukrainian crisis, and so we discussed this crisis at length and in detail today.",ukrainian
1134,2014-08-15 17:15:00,This crisis concerns not just Ukraine itself but has a wider impact and has an effect on many different issues.,ukraine
1134,2014-08-15 17:15:00,"Today, we heard the news that the Russian Federation’s humanitarian mission is going ahead and that an understanding has been reached between Ukraine, Russia, and the Red Cross on delivering this humanitarian aid.",ukraine
1134,2014-08-15 17:15:00,"But for the guns to fall silent there must be mutual trust, and here we need the Russian Federation to take some steps too, for example, ensuring that no weapons cross the Russian-Ukrainian state border.",ukrainian
1138,2014-08-26 16:30:00,"The format we are using here – the Customs Union   Background information Customs Union between Russia, Belarus, and Kazakhstan   -Ukraine-EU – gives us a good opportunity to discuss issues pertaining to the impact of signing by Ukraine of the EU Association Agreement within the context of its cooperation with the Customs Union states.",ukraine
1138,2014-08-26 16:30:00,"As you may know, Ukraine is deeply integrated into the CIS   Background information Commonwealth of Independent States (CIS)    economic space.",ukraine
1138,2014-08-26 16:30:00,Russian capital represents about 32 percent of the Ukrainian banking system.,ukrainian
1138,2014-08-26 16:30:00,The Customs Union states are Ukraine’s key foreign trade partners.,ukraine
1138,2014-08-26 16:30:00,The Customs Union accounts for 30 percent of Ukraine’s exports.,ukraine
1138,2014-08-26 16:30:00,I would like to stress here that Ukraine took a very active stance in this respect.,ukraine
1138,2014-08-26 16:30:00,"However, the question arises of whether this would be possible if the Ukraine’s association agreement with the EU really starts to work.",ukraine
1138,2014-08-26 16:30:00,"Russia has stated on numerous occasions that full acceptance by our Ukrainian friends of all the tariff liberalisation requirements and the adoption of the European Union technical, sanitary and veterinary norms will have a negative impact on the scope and dynamics of trade and investment cooperation in Eurasia.",ukrainian
1138,2014-08-26 16:30:00,"Not to mention the fact that all these norms – the EU sanitary norms and regulations that we do not apply or apply only partially, and the technical regulations will actually close the Ukrainian market for our goods, for goods from the Customs Union and Russia.",ukrainian
1138,2014-08-26 16:30:00,The rejection of common CIS technical norms and adaptation to EU standards will cost Ukraine billions of euros.,ukraine
1138,2014-08-26 16:30:00,"As soon as Ukraine introduces zero import duty on goods from the EU, a step envisaged right after the ratification of the agreement that would apply to 98 percent of all the goods, there will obviously be a sharp increase in the supply of European goods to the Ukrainian market.",ukraine
1138,2014-08-26 16:30:00,"We understand our European partners; they have already developed the Ukrainian market rather well, and would like to get hold of whatever is left and squeeze out everyone else.",ukrainian
1138,2014-08-26 16:30:00,"Besides, less competitive Ukrainian produce will also be squeezed out from its own market.",ukrainian
1138,2014-08-26 16:30:00,"We should not rule out the risk of illegal re-export to the Customs Union market of goods from the EU under the guise of Ukrainian produce, either.",ukrainian
1138,2014-08-26 16:30:00,"However, let us bear in mind that China and Canada are far away, while economic relations between Russia and Ukraine are a completely different story.",ukraine
1138,2014-08-26 16:30:00,"In full compliance with the provisions of the CIS agreement on the free trade zone and with WTO norms, I would like to stress this, we would be forced to cancel preferences for imports from Ukraine.",ukraine
1138,2014-08-26 16:30:00,We will simply be forced to introduce a regular trade regime for Ukraine.,ukraine
1138,2014-08-26 16:30:00,We will of course take a very careful look at the application by our Ukrainian friends of the phyto-sanitary norms envisaged by the EU Association Agreement and we will mirror them.,ukrainian
1138,2014-08-26 16:30:00,"We will introduce the exact same norms for Ukraine; and as regards the industry, one of the major components here, as I have said, is establishing the origin of the goods.",ukraine
