source_doc_id,date,sentence,found_term
1776,2015-12-17 15:15:00,Now Ukraine is officially allowed to keep both compliant and non-compliant products in their market.,ukraine
1776,2015-12-17 15:15:00,And you want us to change the CIS customs regulations just because Ukraine entered into this agreement with the EU.,ukraine
1776,2015-12-17 15:15:00,Ukraine is willing to do so,ukraine
1776,2015-12-17 15:15:00,We are not going to impose any sanctions on Ukraine – I want this to be heard.,ukraine
1776,2015-12-17 15:15:00,Which means conditions for Ukraine will not be any worse than those for our other foreign partners.,ukraine
1776,2015-12-17 15:15:00,"But of course, Russia will grant no more privileges or preferences to Ukraine from January 1, 2016.",ukraine
1776,2015-12-17 15:15:00,"In practice, it means that the zero tariffs in trade between Russia and Ukraine will change to the weighted average tariff of 6 percent.",ukraine
1776,2015-12-17 15:15:00,"On the contrary, we are interested in resolving this conflict as soon as possible, but not by way of physical annihilation of people in southeastern Ukraine.",ukraine
1776,2015-12-17 15:15:00,Even in those territories of Donbass and the Lugansk Region that are controlled by the Ukrainian authorities more than 43 percent voted for the opposition.,ukrainian
1776,2015-12-17 15:15:00,They are actively operating in another former Soviet republic – independent Ukraine.,ukraine
1776,2015-12-17 15:15:00,I think this is simply a slap in the face of the Ukrainian people.,ukrainian
1776,2015-12-17 15:15:00,"By the way, I think Saakashvili was never granted a work visa to the United States but they sent him to run the show in Ukraine and he is functioning there.",ukraine
1776,2015-12-17 15:15:00,What was Ukraine told?,ukraine
1776,2015-12-17 15:15:00,This is simply a slap in the face of the Ukrainian people.,ukrainian
1776,2015-12-17 15:15:00,Regarding transit through Ukraine.,ukraine
1776,2015-12-17 15:15:00,I am not sure this should be done –cut off transit through Ukraine.,ukraine
1776,2015-12-17 15:15:00,"But speaking about the capacity of Ukrainian transit and that of, say, Nord Stream-2…",ukrainian
1776,2015-12-17 15:15:00,Are our Ukrainian partners able to do what we together with our European partners have been doing with regard to Nord Stream?,ukrainian
1780,2015-12-22 15:20:00,"Here is the most recent example: our talks with the European Union and Ukraine on Ukraine’s accession, essentially, to the EU’s free trade zone.",ukraine
1780,2015-12-22 15:20:00,This will mean – because we cannot do this in one go – that none of our agricultural products will be permitted in the Ukrainian market.,ukrainian
1780,2015-12-22 15:20:00,"At the same time, if zero customs fees remain in place between the EU and Ukraine and between us and Ukraine all European products will go to the Ukrainian market, replacing our products, and to our market.",ukraine
1780,2015-12-22 15:20:00,Or lose that Ukrainian market.”,ukrainian
1780,2015-12-22 15:20:00,"Large-scale assembly will occur in Ukraine and this entire flow will pour into our nation, in any sector.",ukraine
1780,2015-12-22 15:20:00,We want to establish relations with our partners on this matter – with Ukraine and the European Union.,ukraine
1799,2016-01-11 06:00:00,"These are the people that were frightened by the coup; let’s be frank, they were worried by the coup d’état in Ukraine.",ukraine
1799,2016-01-11 06:00:00,"To threaten Russians and Russian-speaking people living in Ukraine and in Crimea in particular, because it was more densely populated by Russians and Russian-speaking than other parts of Ukraine.",ukraine
1799,2016-01-11 06:00:00,"We used the Armed Forces only to stop more than 20,000 Ukrainian service members stationed there from interfering with the free expression of will by the residents of Crimea.",ukrainian
1799,2016-01-11 06:00:00,"Firstly, the Crimean Parliament was elected in 2010, that is when Crimea was still part of Ukraine.",ukraine
1799,2016-01-11 06:00:00,The Parliament that had been elected while Crimea was part of Ukraine met and voted for independence and called a referendum.,ukraine
1799,2016-01-11 06:00:00,"As to the reaction of our western partners, I believe that it was wrong and it was not aimed at supporting Ukraine but at suppressing the growth of Russia’s capabilities.",ukraine
1799,2016-01-11 06:00:00,"There is a framework within which she has to work but I have no doubt that she is sincere in her efforts to find solutions, including to the situation in southeast Ukraine.",ukraine
1799,2016-01-11 06:00:00,"Look, everything is provided for: Ukraine is to carry out a constitutional reform with its entry into force by the end of 2015 (Paragraph 11).",ukraine
1799,2016-01-11 06:00:00,"Paragraph 9 – reinstatement of full control of the state border by the government of Ukraine based on the Ukrainian law on constitutional reform by the end of 2015, provided that Paragraph 11 has been fulfilled, which stipulates constitutional reform.",ukraine
1799,2016-01-11 06:00:00,"The Ukrainian Government introduced the law on the special status of those territories, a law that had been adopted earlier, into the transitional provisions.",ukrainian
1817,2016-01-25 19:40:00,"Moreover, he promoted the idea of uniting the future entities, and there were 4 then – Russia, Ukraine, Belorussia and, as a matter of fact, the south of Russia, the North Caucasus Federation, as it was called – you know this better than I do.",ukraine
1817,2016-01-25 19:40:00,"Thus, why did they make Donbass part of Ukraine?",ukraine
1842,2016-02-17 17:45:00,"We heard today and in the past that all this depends, first and foremost, on the fulfilment of the Minsk Agreements between the conflicting sides in Ukraine, that were supported by Russia, France and Germany in the Normandy Format, but it seems to me that any objective observer will see today that the ball is in the court of the Ukrainian authorities.",ukraine
1842,2016-02-17 17:45:00,"As you recall, the key here is political settlement, creating the political conditions, the most important of which is amending the Ukrainian Constitution, which is clearly set in the Minsk Agreements: it states in black and white that the Ukrainian side must make amendments to its Constitution by the end of 2015.",ukrainian
1842,2016-02-17 17:45:00,"There are other considerations related to preparing and holding local elections, with implementation of the already adopted law on special status for corresponding regions in Ukraine.",ukraine
1842,2016-02-17 17:45:00,"We will hope that the turbulent political processes there will be overcome and the political forces in Ukraine that truly favour settling this problem will be able to find the strength, to find allies to bring this process to an end.",ukraine
1891,2016-03-24 19:40:00,"I very much hope that your visit will allow us to harmonise our positions as regards further settlement both in Syria and, as you said, in Ukraine. <…>",ukraine
1907,2016-04-06 14:00:00,"I discussed economic matters with Prime Minister Medvedev, and also the sanctions, the Ukraine crisis, human rights and other matters.",ukraine
1908,2016-04-06 17:00:00,The situation in Ukraine was also addressed.,ukraine
1909,2016-04-07 17:00:00,Problems arose in Ukraine and a coup took place.,ukraine
1909,2016-04-07 17:00:00,"I do not have time to go into all the details of our position on the events in southeast Ukraine, and this is not the moment for this.",ukraine
1909,2016-04-07 17:00:00,"In this respect, we really are doing everything we can to replace the energy that used to come from Ukraine.",ukraine
1915,2016-04-14 15:40:00,"On the whole, this is nearing a power transmission volume that was provided from Ukrainian territory.",ukrainian
1915,2016-04-14 15:40:00,This will fully meet the demand that was once met by Ukraine.,ukraine
1915,2016-04-14 15:40:00,"You know, I do not think that our partners will repeal the restrictions and limitations with regard to this country any time soon, even despite the fact that the Minsk agreements regarding southeastern Ukraine are being complied with in a dreadful manner.",ukraine
1915,2016-04-14 15:40:00,Their obviousness lies in the following: Political issues are the top priority when we address all those problems in southeastern Ukraine.,ukraine
1915,2016-04-14 15:40:00,"According to the Minsk agreements, the Ukrainian Constitution had to be amended before the end of 2015.",ukrainian
1915,2016-04-14 15:40:00,"After all, it is not up to us to change the Ukrainian Constitution.",ukrainian
1915,2016-04-14 15:40:00,"However, if the Ukrainian authorities and our European partners really want us to travel that road and come to the right goal, this requires teamwork with the partners in Kiev, where the President, the incoming and outgoing prime ministers, and the entire opposition are linked with Western countries one way or another.",ukrainian
1915,2016-04-14 15:40:00,"I cannot think anything of the new Ukrainian Government, as I know nothing about it.",ukrainian
1915,2016-04-14 15:40:00,"If I am not mistaken, the Ukrainian Government, the former Ukrainian Government now, approved a plan of action in late 2014, which consisted of nine points.",ukrainian
1915,2016-04-14 15:40:00,Today’s Ukraine is just the case.,ukraine
1915,2016-04-14 15:40:00,"However, inflation in Ukraine is over 48 percent, can you imagine that?",ukraine
1915,2016-04-14 15:40:00,"However, we need a stable and prosperous Ukraine.",ukraine
1915,2016-04-14 15:40:00,"Some are trying to raise a scandal over offshore assets, but in Ukraine, even the national leaders are billionaires and entrepreneurs with offshore companies.",ukraine
1915,2016-04-14 15:40:00,"Nevertheless, we are interested in Ukraine getting back on its feet, in having a reliable partner and in ensuring that what is happening now, even in the economic sphere, does not happen again.",ukraine
1915,2016-04-14 15:40:00,"Yes, we introduced countermeasures in response to Ukraine joining the EU sanctions against Russia, but we introduced them six months after they did.",ukraine
1916,2016-04-14 16:00:00,We are in touch with the Ukrainian government on this matter.,ukrainian
1984,2016-05-26 08:05:00,"I am convinced that we should draw appropriate conclusions from the events in Ukraine and proceed to establishing, in the vast space stretching between the Atlantic and the Pacific Oceans, a zone of economic and humanitarian cooperation based on the architecture of equal and indivisible security.",ukraine
1990,2016-05-27 23:30:00,Our first objective was to return two Russian nationals convicted by a Ukrainian court and serving a sentence in a Ukrainian penitentiary.,ukrainian
1990,2016-05-27 23:30:00,It has nothing to do with the Minsk Agreements because they speak of persons detained in Donbass and in Ukraine after they were removed from Donbass.,ukraine
1990,2016-05-27 23:30:00,"I personally think that this work should be completed, and all the people who are being detained by the Ukrainian side and by the Donbass side should be released.",ukrainian
1990,2016-05-27 23:30:00,Amendments to the Ukrainian Constitution should be made in accordance with the Minsk Agreements.,ukrainian
1990,2016-05-27 23:30:00,"They have to do with decentralisation, as they like to say in Ukraine.",ukraine
1993,2016-05-28 01:30:00,Or take our neighbours in Ukraine.,ukraine
1993,2016-05-28 01:30:00,While Ukraine had an inflation of 48.7 percent.,ukraine
1993,2016-05-28 01:30:00,"Or take the average pension: $200 in Russia, and $76 in Ukraine.",ukraine
1993,2016-05-28 01:30:00,"In Ukraine, there is no indexation at all, and the pension age was increased.",ukraine
1993,2016-05-28 01:30:00,And what about Ukraine?,ukraine
2017,2016-06-17 16:20:00,Why did they have to support the coup in Ukraine?,ukraine
2017,2016-06-17 16:20:00,"But no, they had to proceed with a coup, casualties, unleash bloodshed, a civil war, and scare the Russian-speaking population of southeastern Ukraine and Crimea.",ukraine
2017,2016-06-17 16:20:00,"It was passed by the Ukrainian parliament but was never signed by the president, it has no effect.",ukrainian
2017,2016-06-17 16:20:00,"If you ask them, they say, “It is Ukrainian government forces, the Ukrainian army.”",ukrainian
2019,2016-06-17 20:00:00,"Of course, we discussed the settlement of crises in Ukraine, Syria and other areas, where there is no peace yet.",ukraine
2019,2016-06-17 20:00:00,"I am not the President of Ukraine, so I cannot sign the law for him.",ukraine
2019,2016-06-17 20:00:00,"I understand that it is not easy to make such decisions in Ukraine now, that they require a lot of political courage and support of the public and key political forces.",ukraine
2019,2016-06-17 20:00:00,"Why don’t they work with their allies in Kiev instead, if they really mean well for the Ukrainian people.",ukrainian
2021,2016-06-17 23:55:00,We have also not completely given up on transit via Ukraine.,ukraine
2021,2016-06-17 23:55:00,"If Ukraine comes to understand that it does not have exclusive rights to shipping Russian energy to Europe, certain officials in this country will not be blackmailed anymore and we will be able to cooperate in a normal businesslike manner.",ukraine
2021,2016-06-17 23:55:00,"In this regard, I would like to emphasise that, in general, we may still consider involvement in Ukraine’s gas transit system.",ukraine
2021,2016-06-17 23:55:00,"In order to comply with Ukrainian law, we proposed leasing the Ukrainian gas transit system through an international consortium instead of buying it, committing also to the maintenance and improvements.",ukrainian
2021,2016-06-17 23:55:00,"As you may recall, it came down to their demand that we drop the price to the lowest rate and offer Ukraine a non-market rate, or they will shut down transit.",ukraine
2021,2016-06-17 23:55:00,We must secure ourselves against issues like this and continue normal cooperation with Ukraine.,ukraine
2021,2016-06-17 23:55:00,"By the way, if our Ukrainian partners offer us an economically feasible project today that would guarantee secure supplies and economic efficiency we would work with them.",ukrainian
2034,2016-06-24 16:40:00,"We cannot amend the Ukrainian Constitution; we cannot implement and enforce the law on special forms of governance in the well-known territories, the Lugansk and Donetsk People’s Republics; we cannot sign an amnesty law for the Ukrainian president.",ukrainian
2034,2016-06-24 16:40:00,"Nevertheless, we have worked patiently and are willing to continue working just as patiently both with our Ukrainian partners and with our EU partners.",ukrainian
2045,2016-06-30 14:10:00,"Two years ago, the list of regional hotspots got the addition of Ukraine, much to our regret, where the flames of internal conflict were fanned at the cost of human lives, destruction of economic ties, and streams of refugees, including into Russia.",ukraine
2045,2016-06-30 14:10:00,We genuinely want to see the Ukrainian crisis resolved as swiftly as possible and we will continue working on this with the other Normandy Format participants and with the United States.,ukrainian
2045,2016-06-30 14:10:00,We want to see a Ukraine that is a good neighbour and a predictable and civilised partner living in peace at home and in the world.,ukraine
2045,2016-06-30 14:10:00,"It is unacceptable to prolong the Ukrainian crisis and unacceptable to blame others for this, particularly Russia.",ukrainian
2049,2016-07-01 19:30:00,"It wasn’t Russia that staged a coup d’etat in Ukraine and it wasn’t Russia that threatened the life, health and security of residents of the Crimean peninsula.",ukraine
2066,2016-07-25 14:10:00,It used to be in Ukraine?,ukraine
2078,2016-08-05 11:05:00,"Nevertheless, Azerbaijan ranks fifth in Russia's foreign trade with the CIS countries (following Belarus, Kazakhstan, Ukraine and Uzbekistan).",ukraine
2088,2016-08-10 18:30:00,"Indeed, our intelligence services prevented a sabotage and reconnaissance group from the Ukrainian Defence Ministry from infiltrating Crimean territory.",ukrainian
2088,2016-08-10 18:30:00,"However, I think that the situation is actually even more worrying because acts such as this have no sense other than to divert the people in Ukraine itself from the lamentable economic situation and the serious difficulties in which many people there live today.",ukraine
2092,2016-08-19 14:50:00,He will be offered a job as a special representative of the President of the Russian Federation on trade and economic ties with Ukraine.,ukraine
2093,2016-08-19 15:30:00,"Obviously, we are meeting following a well-known incident, after disrupting an attempt by Ukrainian commando units to infiltrate the territory of Crimea.",ukrainian
2093,2016-08-19 15:30:00,"For this reason, a decision was made to appoint former Education Minister Dmitry Livanov Special Presidential Representative for Trade and Economic Relations with Ukraine.",ukraine
2113,2016-09-03 08:20:00,We are not responsible for the Ukraine’s crisis.,ukraine
2113,2016-09-03 08:20:00,"We did not support the unconstitutional coup in Ukraine, and we did not provoke the reaction of part of the country’s population to these actions.",ukraine
2113,2016-09-03 08:20:00,"As for the settlement in south-eastern Ukraine, I am in total agreement with the participants of the process, first of all the participants of the Normandy process, and with the position of the United States: there is no alternative to implementing the Minsk agreements.",ukraine
2113,2016-09-03 08:20:00,By late 2015 amendments were to be made to the Ukrainian constitution.,ukrainian
2113,2016-09-03 08:20:00,"But, of course, without the political will of the Ukrainian leadership it is impossible, and ultimately everything depends on them.",ukrainian
2119,2016-09-04 18:20:00,"Also, I think we should discuss the situations in Syria and Ukraine, since we are all involved in addressing these problems.",ukraine
2119,2016-09-04 18:20:00,"As for Ukraine, we need to discuss further cooperation in the Normandy format.",ukraine
2120,2016-09-04 19:50:00,"I mean, for example, Ukraine.",ukraine
2121,2016-09-05 10:30:00,"So, yes, our military personnel were in Crimea; but they did not even outnumber our grouping that had been present there under the treaty we had with Ukraine.",ukraine
2121,2016-09-05 10:30:00,"Most importantly, though, the Crimean parliament, which had been elected two years prior to the voting under the Ukrainian law, voted in favour of the referendum and later, in favour of independence.",ukrainian
2124,2016-09-05 17:20:00,Can Japan’s position on Ukraine get in the way here?,ukraine
2124,2016-09-05 17:20:00,"The second matter we discussed, of course, was settling the situation in Ukraine.",ukraine
2124,2016-09-05 17:20:00,"Yes, we did indeed mostly discuss the Ukrainian crisis.",ukrainian
2142,2016-09-16 17:50:00,Everything that has happened in Crimea is the result of illegitimate actions by certain political forces in Ukraine who provoked a coup d’état.,ukraine
2142,2016-09-16 17:50:00,"As is known, unfortunately, Ukraine has not signed or ratified the CIS Charter, and so it can hardly lay claim to submitting its proposals regarding the organisation’s working procedure.",ukraine
2144,2016-09-17 12:15:00,"I have already said that we are ready to continue contacts as long as they lead to a positive result, to a resolution of the crisis in Ukraine.",ukraine
2144,2016-09-17 12:15:00,"We want Ukraine to develop as an independent state, strong economically and in every other aspect; we want to have a reliable, stable partner.",ukraine
2144,2016-09-17 12:15:00,"We cannot, for example, amend the Ukrainian Constitution – only Ukraine can do this, only the Ukrainian leadership.",ukraine
2144,2016-09-17 12:15:00,"We cannot sign an amnesty law instead of the Ukrainian President, and we cannot adopt a law on elections.",ukrainian
2144,2016-09-17 12:15:00,"We can do almost nothing, only the Ukrainian people and their representatives are able to do it.",ukrainian
2154,2016-09-21 20:00:00,There are complicated issues related to Syria and Ukraine.,ukraine
2187,2016-10-12 16:30:00,You just mentioned the crisis in Ukraine.,ukraine
2187,2016-10-12 16:30:00,"However, we were not the ones who brought about a coup d’état in Ukraine.",ukraine
2187,2016-10-12 16:30:00,"I cannot help repeating: we cannot amend the Ukrainian Constitution for the current Kiev authorities, which is a key factor.",ukrainian
2187,2016-10-12 16:30:00,I cannot sign the amnesty law adopted by the Rada; I just cannot do this for the Ukrainian President.,ukrainian
2187,2016-10-12 16:30:00,"On September 9, the self-defenders of Donbass unilaterally, I would like to stress, said they would not respond to the Ukrainian Armed Forces’ shelling.",ukrainian
2196,2016-10-16 14:30:00,Regarding the question of whether Ukraine is delivering on its commitments.,ukraine
2196,2016-10-16 14:30:00,"In general, regarding sanctions against Russia, no matter whether introduced over developments in southeastern Ukraine or in Syria, I can tell you that the goal of those who formulate and advocate this policy is not to settle a specific problem, for example, in southeastern Ukraine, but to contain Russia.",ukraine
2196,2016-10-16 14:30:00,"Even without Ukraine, they would have found some other pretext.",ukraine
2196,2016-10-16 14:30:00,"This dependency is gradually fading, not only with regard to Ukrainian suppliers, but other countries as well, including European countries and the US.",ukrainian
2196,2016-10-16 14:30:00,One hundred percent – I would like to stress this – of our helicopters used to be outfitted with Ukrainian engines.,ukrainian
2196,2016-10-16 14:30:00,"Regarding Ukraine, let me thank you for raising this question.",ukraine
2196,2016-10-16 14:30:00,But our Ukrainian partners have only to say the word and we will be ready to involve Ukrainian industry in the effort to meet our consumption demands.,ukrainian
2196,2016-10-16 14:30:00,This includes joint cooperation to modernise Ukraine’s defence enterprises and civilian sectors.,ukraine
2202,2016-10-20 02:20:00,First on the Minsk Agreements: all the participants in today's meeting agreed that a settlement in south-eastern Ukraine should be based on the Minsk Agreements and we all confirmed our commitment to these agreements.,ukraine
2208,2016-10-26 17:10:00,"Incidentally, Ukraine has an excellent centre here.",ukraine
2208,2016-10-26 17:10:00,"I said right from the start that they can use it, that no one will take anything away from them, and that it will belong to the Ukrainian Paralympic family.",ukrainian
2208,2016-10-26 17:10:00,I said that the centre should remain in Ukraine’s hands.,ukraine
2208,2016-10-26 17:10:00,It is good to have our Paralympians know that there is nothing that could be a cause of contention in their relations with their friends in Ukraine.,ukraine
2209,2016-10-27 20:00:00,"As you know, the Minsk agreements, which I think the experts have all read, say in black and white: “Thirty days after the signing of the Minsk agreements Ukraine’s Rada must adopt a resolution outlining the geographical boundaries of areas where the law on the special status of these unrecognised republics would become effective immediately.”",ukraine
2209,2016-10-27 20:00:00,"It was passed, I would like to remind you, by the Parliament of Ukraine.",ukraine
2209,2016-10-27 20:00:00,"But after passing this resolution, Ukraine and its Parliament adopted an amendment, a paragraph to Article 9 or 10, which said the law would take effect only after municipal elections in these areas.",ukraine
2209,2016-10-27 20:00:00,"I repeat, in our opinion, that law is absolutely key to a political resolution to the crisis in southeastern Ukraine.",ukraine
2209,2016-10-27 20:00:00,But the Ukrainian president said that this was not possible and everything ended up in a dead end.,ukrainian
2209,2016-10-27 20:00:00,"But then in Berlin, the Ukrainian president suddenly also attempted to change this proposal, already the result of a compromise.",ukrainian
2209,2016-10-27 20:00:00,"I have always considered, and still do today, that Russians and Ukrainians are really one people.",ukrainian
2209,2016-10-27 20:00:00,There are people who hold radical nationalist views both in Russia and in Ukraine.,ukraine
2209,2016-10-27 20:00:00,"The same concerns our foreign investors, including from Ukraine.",ukraine
2209,2016-10-27 20:00:00,"We are concerned about what is happening now with this very important energy component in Ukraine because in our opinion, in the opinion of our specialists – and they are no worse than Ukrainian experts because in Soviet times this was a single complex – we do realise what is going on there.",ukraine
2209,2016-10-27 20:00:00,I discussed gas shipments to Ukraine with the Ukrainian President at his initiative.,ukraine
2209,2016-10-27 20:00:00,We will provide timely and guaranteed energy supplies for Ukrainian consumers for the amount of this advance payment.,ukrainian
2209,2016-10-27 20:00:00,"But today the price for Ukraine – and we had agreed on this before and said so last year – will not be higher than the price for its neighbours, for instance, Poland.",ukraine
2209,2016-10-27 20:00:00,We could sell gas to Ukraine for $180.,ukraine
2209,2016-10-27 20:00:00,I have reason to believe that the middlemen in these reverse deals are close to certain executives in Ukraine’s fuel and energy complex.,ukraine
2209,2016-10-27 20:00:00,They did this at the request of our Ukrainian partners.,ukrainian
2209,2016-10-27 20:00:00,"But I think, as I have already said, that even if these problems linked with Ukraine, its south-east, Crimea and Syria had not existed, something else would have been found to deter Russia.",ukraine
