source_doc_id,date,sentence,found_term
4453,2021-06-22 10:30:00,"Why did the USA organize the coup and the European countries weak-heartedly support it, provoking a split within Ukraine and the withdrawal of Crimea?",ukraine
4461,2021-06-30 15:50:00,Why is Ukraine not listed among unfriendly countries?,ukraine
4461,2021-06-30 15:50:00,This is because I do not regard Ukraine as a country unfriendly towards Russia.,ukraine
4461,2021-06-30 15:50:00,"I have noted many times, and I can repeat once again that, in my opinion, Ukrainians and Russians are a single people.",ukrainian
4461,2021-06-30 15:50:00,"Their respective languages are more different than the Russian and Ukrainian languages, but they cherish their unity.",ukrainian
4461,2021-06-30 15:50:00,And I hope that people in Russia and Ukraine will read it.,ukraine
4461,2021-06-30 15:50:00,"So, I do not regard the Ukraine people unfriendly.",ukraine
4461,2021-06-30 15:50:00,Russians and Ukrainians are a single people.,ukrainian
4461,2021-06-30 15:50:00,"But the Ukrainian leadership, the current authorities of modern Ukraine are clearly unfriendly to us.",ukraine
4461,2021-06-30 15:50:00,"Otherwise there is no explanation for the draft law submitted by the Ukrainian President to the Verkhovna Rada, the law on indigenous peoples under which Russians are not an indigenous people in that territory.",ukrainian
4461,2021-06-30 15:50:00,"They have flats, jobs and so on in Ukraine.",ukraine
4461,2021-06-30 15:50:00,"And so they will have to reregister [as Ukrainians], because they would be second-class citizens otherwise.",ukrainian
4461,2021-06-30 15:50:00,"You see, there are narrow-minded people and far-right nationalists everywhere; they exist in Russia and also in Ukraine.",ukraine
4461,2021-06-30 15:50:00,This also concerns the suppression of the opposition in Ukraine.,ukraine
4461,2021-06-30 15:50:00,"Viktor Medvedchuk, whom I regard as a Ukrainian nationalist, was seized and confined to his apartment ahead of the election campaign, and they also ordered him to wear an electronic bracelet.",ukrainian
4461,2021-06-30 15:50:00,"The main issues concerning Ukraine’s functioning are not decided in Kiev but in Washington and, partly, in Berlin and Paris.",ukraine
4461,2021-06-30 15:50:00,"Look now, they raised a clamour over the fact that we were conducting exercises on our own territory near the Ukrainian border.",ukrainian
4461,2021-06-30 15:50:00,"I am worried about another, more fundamental thing, namely, the beginning of military development in Ukrainian territory.",ukrainian
4461,2021-06-30 15:50:00,"Under the Ukrainian Constitution, no foreign bases can be established in the country.",ukrainian
4477,2021-07-12 17:00:00,"During the recent Direct Line, when I was asked about Russian-Ukrainian relations, I said that Russians and Ukrainians were one people – a single whole.",ukrainian
4477,2021-07-12 17:00:00,"First of all, I would like to emphasize that the wall that has emerged in recent years between Russia and Ukraine, between the parts of what is essentially the same historical and spiritual space, to my mind is our great common misfortune and tragedy.",ukraine
4477,2021-07-12 17:00:00,"But I will focus on the key, pivotal moments that are important for us to remember, both in Russia and Ukraine.",ukraine
4477,2021-07-12 17:00:00,"Russians, Ukrainians, and Belarusians are all descendants of Ancient Rus, which was the largest state in Europe.",ukrainian
4477,2021-07-12 17:00:00,"The name ”Ukraine“ was used more often in the meaning of the Old Russian word ”okraina“ (periphery), which is found in written sources from the 12th century, referring to various border territories.",ukraine
4477,2021-07-12 17:00:00,"And the word ”Ukrainian“, judging by archival documents, originally referred to frontier guards who protected the external borders.",ukrainian
4477,2021-07-12 17:00:00,"Incidentally, during the Soviet period, natives of Ukraine held major, including the highest, posts in the leadership of the unified state.",ukraine
4477,2021-07-12 17:00:00,"Suffice it to say that Nikita Khrushchev and Leonid Brezhnev, whose party biography was most closely associated with Ukraine, led the Communist Party of the Soviet Union (CPSU) for almost 30 years.",ukraine
4477,2021-07-12 17:00:00,"Taras Shevchenko wrote poetry in the Ukrainian language, and prose mainly in Russian.",ukrainian
4477,2021-07-12 17:00:00,How can this heritage be divided between Russia and Ukraine?,ukraine
4477,2021-07-12 17:00:00,"We do know there were the Valuev Circular of 1863 an then the Ems Ukaz of 1876, which restricted the publication and importation of religious and socio-political literature in the Ukrainian language.",ukrainian
4477,2021-07-12 17:00:00,These decisions were taken against the backdrop of dramatic events in Poland and the desire of the leaders of the Polish national movement to exploit the ”Ukrainian issue“ to their own advantage.,ukrainian
4477,2021-07-12 17:00:00,"I should add that works of fiction, books of Ukrainian poetry and folk songs continued to be published.",ukrainian
4477,2021-07-12 17:00:00,"At the same time, the idea of Ukrainian people as a nation separate from the Russians started to form and gain ground among the Polish elite and a part of the Malorussian intelligentsia.",ukrainian
4477,2021-07-12 17:00:00,"Since there was no historical basis – and could not have been any, conclusions were substantiated by all sorts of concoctions, which went as far as to claim that the Ukrainians are the true Slavs and the Russians, the Muscovites, are not.",ukrainian
4477,2021-07-12 17:00:00,"During World War I, Vienna played a role in the formation of the so-called Legion of Ukrainian Sich Riflemen.",ukrainian
4477,2021-07-12 17:00:00,"In November 1917, in its Third Universal, it declared the creation of the Ukrainian People's Republic (UPR) as part of Russia.",ukrainian
4477,2021-07-12 17:00:00,"At a meeting on 10 January 1918, the head of the Ukrainian delegation read out a note proclaiming the independence of Ukraine.",ukraine
4477,2021-07-12 17:00:00,"Subsequently, the Central Rada proclaimed Ukraine independent in its Fourth Universal.",ukraine
4477,2021-07-12 17:00:00,Germany and Austria-Hungary were at the time in a dire situation and needed Ukrainian bread and raw materials.,ukrainian
4477,2021-07-12 17:00:00,"For those who have today given up the full control of Ukraine to external forces, it would be instructive to remember that, back in 1918, such a decision proved fatal for the ruling regime in Kiev.",ukraine
4477,2021-07-12 17:00:00,"With the direct involvement of the occupying forces, the Central Rada was overthrown and Hetman Pavlo Skoropadskyi was brought to power, proclaiming instead of the UPR the Ukrainian State, which was essentially under German protectorate.",ukrainian
4477,2021-07-12 17:00:00,"In November 1918 – following the revolutionary events in Germany and Austria-Hungary – Pavlo Skoropadskyi, who had lost the support of German bayonets, took a different course, declaring that ”Ukraine is to take the lead in the formation of an All-Russian Federation“.",ukraine
4477,2021-07-12 17:00:00,"In autumn 1918, Ukrainian nationalists proclaimed the West Ukrainian People's Republic (WUPR) and, in January 1919, announced its unification with the Ukrainian People's Republic.",ukrainian
4477,2021-07-12 17:00:00,"In July 1919, Ukrainian forces were crushed by Polish troops, and the territory of the former WUPR came under the Polish rule.",ukrainian
4477,2021-07-12 17:00:00,"In April 1920, Symon Petliura (portrayed as one of the ”heroes“ in today's Ukraine) concluded secret conventions on behalf of the UPR Directorate, giving up – in exchange for military support – Galicia and Western Volhynia lands to Poland.",ukraine
4477,2021-07-12 17:00:00,"During a meeting with the republic's leaders, Vladimir Lenin insisted that they act as part of Soviet Ukraine.",ukraine
4477,2021-07-12 17:00:00,"On 15 March 1918, the Central Committee of the Russian Communist Party (Bolsheviks) directly ordered that delegates be sent to the Ukrainian Congress of Soviets, including from the Donetsk Basin, and that ”one government for all of Ukraine“ be created at the congress.",ukraine
4477,2021-07-12 17:00:00,The territories of the Donetsk-Krivoy Rog Soviet Republic later formed most of the regions of south-eastern Ukraine.,ukraine
4477,2021-07-12 17:00:00,"Under the 1921 Treaty of Riga, concluded between the Russian SFSR, the Ukrainian SSR and Poland, the western lands of the former Russian Empire were ceded to Poland.",ukrainian
4477,2021-07-12 17:00:00,"In the interwar period, the Polish government pursued an active resettlement policy, seeking to change the ethnic composition of the Eastern Borderlands – the Polish name for what is now Western Ukraine, Western Belarus and parts of Lithuania.",ukraine
4477,2021-07-12 17:00:00,"Later, during World War II, radical groups of Ukrainian nationalists used this as a pretext for terror not only against Polish, but also against Jewish and Russian populations.",ukrainian
4477,2021-07-12 17:00:00,"In 1922, when the USSR was created, with the Ukrainian Soviet Socialist Republic becoming one of its founders, a rather fierce debate among the Bolshevik leaders resulted in the implementation of Lenin's plan to form a union state as a federation of equal republics.",ukrainian
4477,2021-07-12 17:00:00,"“ By the way, Ukraine never signed or ratified the CIS Charter adopted back in 1993.",ukraine
4477,2021-07-12 17:00:00,"In the 1920's-1930's, the Bolsheviks actively promoted the ”localization policy“, which took the form of Ukrainization in the Ukrainian SSR.",ukrainian
4477,2021-07-12 17:00:00,"Symbolically, as part of this policy and with consent of the Soviet authorities, Mikhail Grushevskiy, former chairman of Central Rada, one of the ideologists of Ukrainian nationalism, who at a certain period of time had been supported by Austria-Hungary, was returned to the USSR and was elected member of the Academy of Sciences.",ukrainian
4477,2021-07-12 17:00:00,"The localization policy undoubtedly played a major role in the development and consolidation of the Ukrainian culture, language and identity.",ukrainian
4477,2021-07-12 17:00:00,"At the same time, under the guise of combating the so-called Russian great-power chauvinism, Ukrainization was often imposed on those who did not see themselves as Ukrainians.",ukrainian
4477,2021-07-12 17:00:00,"This Soviet national policy secured at the state level the provision on three separate Slavic peoples: Russian, Ukrainian and Belorussian, instead of the large Russian nation, a triune people comprising Velikorussians, Malorussians and Belorussians.",ukrainian
4477,2021-07-12 17:00:00,A major portion of these became part of the Soviet Ukraine.,ukraine
4477,2021-07-12 17:00:00,"In 1940, the Ukrainian SSR incorporated part of Bessarabia, which had been occupied by Romania since 1918, as well as Northern Bukovina.",ukrainian
4477,2021-07-12 17:00:00,"In 1948, Zmeyiniy Island (Snake Island) in the Black Sea became part of Ukraine.",ukraine
4477,2021-07-12 17:00:00,"In 1954, the Crimean Region of the RSFSR was given to the Ukrainian SSR, in gross violation of legal norms that were in force at the time.",ukrainian
4477,2021-07-12 17:00:00,"In summer 1945, the historical act of the reunification of Carpathian Ukraine ”with its ancient motherland, Ukraine“ – as The Pravda newspaper put it – was announced.",ukraine
4477,2021-07-12 17:00:00,"Therefore, modern Ukraine is entirely the product of the Soviet era.",ukraine
4477,2021-07-12 17:00:00,"To make sure of that, it is enough to look at the boundaries of the lands reunited with the Russian state in the 17th century and the territory of the Ukrainian SSR when it left the Soviet Union.",ukrainian
4477,2021-07-12 17:00:00,The leaders of modern Ukraine and their external ”patrons“ prefer to overlook these facts.,ukraine
4477,2021-07-12 17:00:00,"The Russian Federation recognized the new geopolitical realities: and not only recognized, but, indeed, did a lot for Ukraine to establish itself as an independent country.",ukraine
4477,2021-07-12 17:00:00,"Throughout the difficult 1990's and in the new millennium, we have provided considerable support to Ukraine.",ukraine
4477,2021-07-12 17:00:00,"Whatever ”political arithmetic“ of its own Kiev may wish to apply, in 1991–2013, Ukraine's budget savings amounted to more than USD 82 billion, while today, it holds on to the mere USD 1.5 billion of Russian payments for gas transit to Europe.",ukraine
4477,2021-07-12 17:00:00,"If economic ties between our countries had been retained, Ukraine would enjoy the benefit of tens of billions of dollars.",ukraine
4477,2021-07-12 17:00:00,Ukraine and Russia have developed as a single economic system over decades and centuries.,ukraine
4477,2021-07-12 17:00:00,"Ukraine used to possess great potential, which included powerful infrastructure, gas transportation system, advanced shipbuilding, aviation, rocket and instrument engineering industries, as well as world-class scientific, design and engineering schools.",ukraine
4477,2021-07-12 17:00:00,"Taking over this legacy and declaring independence, Ukrainian leaders promised that the Ukrainian economy would be one of the leading ones and the standard of living would be among the best in Europe.",ukrainian
4477,2021-07-12 17:00:00,"Today, high-tech industrial giants that were once the pride of Ukraine and the entire Union, are sinking.",ukraine
4477,2021-07-12 17:00:00,"The scale of deindustrialization and overall economic degradation is visible in Ukraine's electricity production, which has seen a nearly two-time decrease in 30 years.",ukraine
4477,2021-07-12 17:00:00,"Finally, according to IMF reports, in 2019, before the coronavirus pandemic broke out, Ukraine's GDP per capita had been below USD 4 thousand.",ukraine
4477,2021-07-12 17:00:00,"Nowadays, Ukraine is Europe's poorest country.",ukraine
4477,2021-07-12 17:00:00,Is it the people of Ukraine's fault?,ukraine
4477,2021-07-12 17:00:00,It was the Ukrainian authorities who waisted and frittered away the achievements of many generations.,ukrainian
4477,2021-07-12 17:00:00,We know how hardworking and talented the people of Ukraine are.,ukraine
4477,2021-07-12 17:00:00,"The feelings of millions of people who treat Russia not just well but with great affection, just as we feel about Ukraine, remain the same.",ukraine
4477,2021-07-12 17:00:00,They brought tangible benefits to people – both in Russia and Ukraine.,ukraine
4477,2021-07-12 17:00:00,"And that is why we had a fruitful interaction with all, I emphasize, with all the leaders of Ukraine.",ukraine
4477,2021-07-12 17:00:00,"Nevertheless, Russia is still one of Ukraine's top three trading partners, and hundreds of thousands of Ukrainians are coming to us to work, and they find a welcome reception and support.",ukraine
4477,2021-07-12 17:00:00,"When the USSR collapsed, many people in Russia and Ukraine sincerely believed and assumed that our close cultural, spiritual and economic ties would certainly last, as would the commonality of our people, who had always had a sense of unity at their core.",ukraine
4477,2021-07-12 17:00:00,"In essence, Ukraine's ruling circles decided to justify their country's independence through the denial of its past, however, except for border issues.",ukraine
4477,2021-07-12 17:00:00,"They began to mythologize and rewrite history, edit out everything that united us, and refer to the period when Ukraine was part of the Russian Empire and the Soviet Union as an occupation.",ukraine
4477,2021-07-12 17:00:00,The common tragedy of collectivization and famine of the early 1930s was portrayed as the genocide of the Ukrainian people.,ukrainian
4477,2021-07-12 17:00:00,"They were indulged by both the official authorities and local oligarchs, who robbed the people of Ukraine and kept their stolen money in Western banks, ready to sell their motherland for the sake of preserving their capital.",ukraine
4477,2021-07-12 17:00:00,"I recall that long ago, well before 2014, the U.S. and EU countries systematically and consistently pushed Ukraine to curtail and limit economic cooperation with Russia.",ukraine
4477,2021-07-12 17:00:00,"We, as the largest trade and economic partner of Ukraine, suggested discussing the emerging problems in the Ukraine-Russia-EU format.",ukraine
4477,2021-07-12 17:00:00,But every time we were told that Russia had nothing to do with it and that the issue concerned only the EU and Ukraine.,ukraine
4477,2021-07-12 17:00:00,"Step by step, Ukraine was dragged into a dangerous geopolitical game aimed at turning Ukraine into a barrier between Europe and Russia, a springboard against Russia.",ukraine
4477,2021-07-12 17:00:00,"Inevitably, there came a time when the concept of ”Ukraine is not Russia“ was no longer an option.",ukraine
4477,2021-07-12 17:00:00,And there is no need to deceive anyone that this is being done in the interests of the people of Ukraine.,ukraine
4477,2021-07-12 17:00:00,"The Polish-Lithuanian Commonwealth never needed Ukrainian culture, much less Cossack autonomy.",ukrainian
4477,2021-07-12 17:00:00,"The Nazis, abetted by collaborators from the OUN-UPA, did not need Ukraine, but a living space and slaves for Aryan overlords.",ukraine
4477,2021-07-12 17:00:00,Nor were the interests of the Ukrainian people thought of in February 2014.,ukrainian
4477,2021-07-12 17:00:00,Western countries directly interfered in Ukraine's internal affairs and supported the coup.,ukraine
4477,2021-07-12 17:00:00,"Their slogans, ideology, and blatant aggressive Russophobia have to a large extent become defining elements of state policy in Ukraine.",ukraine
4477,2021-07-12 17:00:00,Only those who constitute an ethnic minority and do not have their own state entity outside Ukraine are recognized as indigenous.,ukraine
4477,2021-07-12 17:00:00,"There may be an argument: if you are talking about a single large nation, a triune nation, then what difference does it make who people consider themselves to be – Russians, Ukrainians, or Belarusians.",ukrainian
4477,2021-07-12 17:00:00,But the fact is that the situation in Ukraine today is completely different because it involves a forced change of identity.,ukraine
4477,2021-07-12 17:00:00,"And the most despicable thing is that the Russians in Ukraine are being forced not only to deny their roots, generations of their ancestors but also to believe that Russia is their enemy.",ukraine
4477,2021-07-12 17:00:00,"It would not be an exaggeration to say that the path of forced assimilation, the formation of an ethnically pure Ukrainian state, aggressive towards Russia, is comparable in its consequences to the use of weapons of mass destruction against us.",ukrainian
4477,2021-07-12 17:00:00,"As a result of such a harsh and artificial division of Russians and Ukrainians, the Russian people in all may decrease by hundreds of thousands or even millions.",ukrainian
4477,2021-07-12 17:00:00,Even extensive autonomy of the Ukrainian Orthodox Church while maintaining spiritual unity with the Moscow Patriarchate strongly displeases them.,ukrainian
4477,2021-07-12 17:00:00,I think it is also natural that the representatives of Ukraine over and over again vote against the UN General Assembly resolution condemning the glorification of Nazism.,ukraine
4477,2021-07-12 17:00:00,"Mazepa, who betrayed everyone, Petliura, who paid for Polish patronage with Ukrainian lands, and Bandera, who collaborated with the Nazis, are ranked as national heroes.",ukrainian
4477,2021-07-12 17:00:00,"Everything is being done to erase from the memory of young generations the names of genuine patriots and victors, who have always been the pride of Ukraine.",ukraine
4477,2021-07-12 17:00:00,"For the Ukrainians who fought in the Red Army, in partisan units, the Great Patriotic War was indeed a patriotic war because they were defending their home, their great common Motherland.",ukrainian
4477,2021-07-12 17:00:00,The anti-Russia project has been rejected by millions of Ukrainians.,ukrainian
4477,2021-07-12 17:00:00,"Were they left any other choice after the riots that swept through the cities of Ukraine, after the horror and tragedy of 2 May 2014 in Odessa where Ukrainian neo-Nazis burned people alive making a new Khatyn out of it?",ukraine
4477,2021-07-12 17:00:00,"During official negotiations, especially after being reined in by Western partners, Ukraine's representatives regularly declare their ”full adherence“ to the Minsk agreements, but are in fact guided by a position of ”unacceptability“.",ukraine
4477,2021-07-12 17:00:00,"And secondly, the outcome of both Minsk‑1 and Minsk‑2 which give a real chance to peacefully restore the territorial integrity of Ukraine by coming to an agreement directly with the DPR and LPR with Russia, Germany and France as mediators, contradicts the entire logic of the anti-Russia project.",ukraine
4477,2021-07-12 17:00:00,"First of all, we are facing the creation of a climate of fear in Ukrainian society, aggressive rhetoric, indulging neo-Nazis and militarising the country.",ukrainian
4477,2021-07-12 17:00:00,"Along with that we are witnessing not just complete dependence but direct external control, including the supervision of the Ukrainian authorities, security services and armed forces by foreign advisers, military ”development“ of the territory of Ukraine and deployment of NATO infrastructure.",ukraine
4477,2021-07-12 17:00:00,It is no coincidence that the aforementioned flagrant law on ”indigenous peoples“ was adopted under the cover of large-scale NATO exercises in Ukraine.,ukraine
4477,2021-07-12 17:00:00,This is also a disguise for the takeover of the rest of the Ukrainian economy and the exploitation of its natural resources.,ukrainian
4477,2021-07-12 17:00:00,"From time to time, Ukraine is indeed given financial resources and loans, but under their own conditions and pursuing their own interests, with preferences and benefits for Western companies.",ukraine
4477,2021-07-12 17:00:00,"Apparently, it is assumed that this will have to be done not only by today's generation of Ukrainians but also by their children, grandchildren and probably great-grandchildren.",ukrainian
4477,2021-07-12 17:00:00,"The Western authors of the anti-Russia project set up the Ukrainian political system in such a way that presidents, members of parliament and ministers would change but the attitude of separation from and enmity with Russia would remain.",ukrainian
4477,2021-07-12 17:00:00,And in some ways the situation in Ukraine and around Donbas has even degenerated.,ukraine
4477,2021-07-12 17:00:00,"In the anti-Russia project, there is no place either for a sovereign Ukraine or for the political forces that are trying to defend its real independence.",ukraine
4477,2021-07-12 17:00:00,"Those who talk about reconciliation in Ukrainian society, about dialogue, about finding a way out of the current impasse are labelled as ”pro-Russian“ agents.",ukrainian
4477,2021-07-12 17:00:00,"Again, for many people in Ukraine, the anti-Russia project is simply unacceptable.",ukraine
4477,2021-07-12 17:00:00,"Today, the ”right“ patriot of Ukraine is only the one who hates Russia.",ukraine
4477,2021-07-12 17:00:00,"Moreover, the entire Ukrainian statehood, as we understand it, is proposed to be further built exclusively on this idea.",ukrainian
4477,2021-07-12 17:00:00,"The incumbent authorities in Ukraine like to refer to Western experience, seeing it as a model to follow.",ukraine
4477,2021-07-12 17:00:00,"Incidentally, so do millions of those born in Ukraine who now live in Russia.",ukraine
4477,2021-07-12 17:00:00,Russia is open to dialogue with Ukraine and ready to discuss the most complex issues.,ukraine
4477,2021-07-12 17:00:00,We respect the Ukrainian language and traditions.,ukrainian
4477,2021-07-12 17:00:00,"We respect Ukrainians' desire to see their country free, safe and prosperous.",ukrainian
4477,2021-07-12 17:00:00,I am confident that true sovereignty of Ukraine is possible only in partnership with Russia.,ukraine
4477,2021-07-12 17:00:00,"It is in the hearts and the memory of people living in modern Russia and Ukraine, in the blood ties that unite millions of our families.",ukraine
4477,2021-07-12 17:00:00,And I will say one thing – Russia has never been and will never be ”anti-Ukraine“.,ukraine
4477,2021-07-12 17:00:00,And what Ukraine will be – it is up to its citizens to decide.,ukraine
4479,2021-07-13 22:15:00,"After all, there are many people in Ukraine, millions of people who want to restore relations with Russia.",ukraine
4479,2021-07-13 22:15:00,"Indicatively, the Ukrainian authorities take completely illegal actions that are even outside their competence.",ukrainian
4479,2021-07-13 22:15:00,"In the article I also write that we are a common entity, and so it is intended for all of us, including those who live in modern Russia, those who live in modern Ukraine and the sponsors of the current political leadership of Ukraine.",ukraine
4479,2021-07-13 22:15:00,"There are millions of people like this in Ukraine, too.",ukraine
4479,2021-07-13 22:15:00,"This does not imply our intersecting paths but, rather, interdependent and interwoven destinies of millions of people living in contemporary Ukraine and contemporary Russia.",ukraine
4479,2021-07-13 22:15:00,"As to whom all this is addressed to, and what I had in mind when I was talking about what we have just mentioned, I would just like to note one aspect: People living in Ukraine are unlikely to look calmly at incumbent rulers who gain power under certain slogans and who later change their colour just like chameleons and defend entirely different positions.",ukraine
